{
  "record_id": "01K5A3QA9B2C3D4E5F6G7H8J9K",
  "record_type": "outcome",
  "tenant": "demo-bank",
  "stream": "lending",
  "timestamp": "2026-12-15T09:00:00Z",
  "sequence": 22910,
  "schema_version": "0",
  "origin": "live",
  "references": { "decision_record_id": "01K5A3Q7Z2XV8M9N4B6C1D0E2F" },
  "outcome": {
    "status": "observed",
    "label": "performing",
    "observed_at": "2026-12-15T00:00:00Z",
    "source": "lms://LN-20431/repayment"
  },
  "seal": {
    "prev_hash": "4b07c1d2e3f4a5b6c7d8e9f0a1b2c3d4e5f6a7b8c9d0e1f2a3b4c5d6e7f8e8d2",
    "hash": "c0ffee00aa11bb22cc33dd44ee55ff6600112233445566778899aabbccddeeff",
    "checkpoint": 22910
  }
}
